scrape_time,source,title,url,publish_date,authors,summary,text,top_image
2025-10-23T17:08:07.360264,BBC,"Israel maintaining control deeper inside Gaza than expected, new boundary markers suggest",https://www.bbc.com/news/articles/cx2y00g4x29o?at_medium=RSS&at_campaign=rss,"Thu, 23 Oct 2025 13:35:35 GMT",,Israel has placed boundary markers up to 520m deeper inside Gaza than expected under the ceasefire deal with Hamas.,"New images show Israeli control line deeper into Gaza than expected

4 hours ago Share Save Benedict Garman , Emma Pengelly and Matt Murphy, BBC Verify Share Save

BBC

The Israeli military is exerting control over more of Gaza than expected from the ceasefire deal with Hamas, a BBC Verify analysis has found. Under the first stage of the deal, Israel agreed to retreat to a boundary running along the north, south and east of Gaza. The divide was marked by a yellow line on maps released by the military and has become known as the ""Yellow Line"". But new videos and satellite images show that markers placed by Israeli troops in two areas to mark the divide have been positioned hundreds of metres deeper inside the strip than the expected withdrawal line. Israeli Defence Minister Israel Katz - who instructed troops to place the yellow blocks as markers - warned that anyone crossing the line ""will be met with fire"". There have already been at least two deadly incidents near the boundary line.

The Israel Defense Forces (IDF) did not address the allegations when approached by BBC Verify, stating simply that: ""IDF troops under the Southern Command have begun marking the Yellow Line in the Gaza Strip to establish tactical clarity on the ground."" There has been a consistent lack of clarity as to where exactly the boundary will be imposed, with three separate maps posted by the White House, Donald Trump and the Israeli military in the run up to the ceasefire agreement which came into force on 10 October. On 14 October the IDF issued the latest version marking the Yellow Line on their online map, which is used to communicate its position to people in Gaza. But in the north, near the al-Atatra neighbourhood, drone footage from the IDF showed that a line of six yellow blocks were up to 520m further inside the Strip than would have been expected from the IDF maps. Footage geolocated by BBC Verify showed workers using bulldozers and diggers to move the heavy yellow blocks and place them along the coastal al-Rashid road.

A similar situation was visible in southern Gaza, where a satellite image taken on 19 October showed 10 markers erected near the city of Khan Younis. The line of blocks ranges between 180m-290m inside the Yellow Line set out by the IDF. If these two sections of boundary were typical of how the markers were being placed along the entirety of the line then Israel would be exerting control over a notably larger area than expected from the ceasefire agreement.

Multiple analysts who spoke to BBC Verify suggested that the blocks were intended to create a ""buffer zone"" between Palestinians and IDF personnel. One expert said the move would be consistent with a long-term ""strategic culture"" which seeks to insulate Israel from nearby territories it does not fully control. ""This gives the IDF space to manoeuvre and create a 'kill zone' against potential targets,"" Dr Andreas Krieg, associate professor at King's College London, said. ""Potential targets can be engaged before they reach the IDF perimeter. It is a bit like no man's land that does not belong to anyone – and Israel tends to take that territory from the opponent's chunk not its own."" Three experts who spoke to BBC Verify suggested that the disparity between the markers and the IDF map was an intentional design to warn civilians they are ""approaching an area of increased risk"". Noam Ostfeld, an analyst with the risk consultancy Sibylline, said that some blocks ""seem to be positioned near roads or walls, making them easier to spot"". But a post to X by the Israeli defense minister seemed to suggest that the yellow blocks marked the actual line, warning that ""any violation or attempt to cross the line will be met with fire"".

There is already confusion among Gazans over areas where it is safe to go. Abdel Qader Ayman Bakr, who lives near the temporary boundary in the eastern part of Gaza City's Shejaiya district, told the BBC that, despite promises from Israel of clear markings, he had seen none put in place. ""Each day, we can see Israeli military vehicles and soldiers at a relatively close distance, yet we have no way of knowing whether we are in what is considered a 'safe zone' or 'an active danger zone',"" he said. ""We are constantly exposed to danger, especially since we are forced to remain here because this is where our home once stood."" Since the ceasefire came into effect, the IDF has reported a number of instances of people crossing the Yellow Line. On all occasions the IDF said it fired upon those involved. BBC Verify has obtained and geolocated footage showing the aftermath of one incident on 17 October, which the Hamas-run Civil Defence agency said killed 11 civilians - including women and children all reportedly from the same family. The agency said the Palestinians' vehicle was targeted by Israel after crossing the Yellow Line east of Gaza City in the Zeitoun neighbourhood. The footage showed rescue workers inspecting the burnt out remnants of a vehicle and covering a nearby badly-mangled body of a child with a white sheet. BBC Verify geolocated the video to a spot around 125m over the Yellow Line marked on maps by the IDF. The IDF said warning shots were fired towards a ""suspicious vehicle"" that had crossed the line. The statement added when the vehicle failed to stop troops opened fire ""to remove the threat"".

Israel Defense Forces (IDF)",https://ichef.bbci.co.uk/news/1024/branded_news/4eea/live/594d9c40-b00c-11f0-8cb3-d5e6ece26dfa.png
2025-10-23T17:08:09.368420,TheGuardian,Cuban man deported from US to Eswatini goes on hunger strike in prison,https://www.theguardian.com/world/2025/oct/22/cuban-man-roberto-mosquera-del-peral-deported-from-us-to-eswatini-on-hunger-strike-in-prison,2025-10-22T00:00:00,,"<p>Roberto Mosquera del Peral was sent to African country as part of Trump administration’s immigration crackdown</p><p>A Cuban man <a href=""https://www.theguardian.com/world/2025/oct/06/us-deportees-eswatini-lawyers-ngos"">deported by the Trump administration</a> to the southern African country of Eswatini has started a hunger strike against his detention there, his lawyer said on Wednesday.</p><p>Roberto Mosquera del Peral was among <a href=""https://www.theguardian.com/us-news/2025/jul/16/trump-administration-deports-five-migrants-to-eswatini-in-southern-africa"">five third-country nationals</a> deported from the US to Eswatini, formerly Swaziland, in July.</p> <a href=""https://www.theguardian.com/world/2025/oct/22/cuban-man-roberto-mosquera-del-peral-deported-from-us-to-eswatini-on-hunger-strike-in-prison"">Continue reading...</a>","A Cuban man deported by the Trump administration to the southern African country of Eswatini has started a hunger strike against his detention there, his lawyer said on Wednesday.

Roberto Mosquera del Peral was among five third-country nationals deported from the US to Eswatini, formerly Swaziland, in July.

They have been held in a maximum-security prison along with 10 others deported in October, after a broader ramp-up in third-country removals under the US president’s immigration crackdown.

US officials have said the men deported to Eswatini are convicted criminals. Their lawyers say all of them had finished serving their sentences in the US and that there was no legal basis to imprison them again.

“My client is arbitrarily detained and now his life is on the line,” Alma David, Mosquera del Peral’s US-based attorney, said in a statement, adding that had begun the hunger strike on 15 October.

A spokesperson for Eswatini’s correctional services department had no immediate comment but said he would review the information.

The US Department of Homeland Security wrote on X in June that Mosquera del Peral, 58, had been arrested by immigration authorities in Miami. It said his criminal history included convictions for homicide, aggravated assault on a police officer and aggravated battery.

His attorney David said this was incorrect. She said he had been convicted of attempted murder, not murder, and had finished his sentence before he was deported. She demanded that he be permitted to meet his lawyer in Eswatini.

skip past newsletter promotion Sign up to Headlines US Free newsletter Get the most important US headlines and highlights emailed direct to you every morning Enter your email address Sign up Privacy Notice: Newsletters may contain information about charities, online ads, and content funded by outside parties. If you do not have an account, we will create a guest account for you on Newsletters may contain information about charities, online ads, and content funded by outside parties. If you do not have an account, we will create a guest account for you on theguardian.com to send you this newsletter. You can complete full registration at any time. For more information about how we use your data see our Privacy Policy . We use Google reCaptcha to protect our website and the Google Privacy Policy and Terms of Service apply. after newsletter promotion

A local attorney acting on behalf of the deportees has been engaged in a legal battle to gain access to them, which the Eswatini government has so far refused.","https://i.guim.co.uk/img/media/b6c36edf0f410ad9d2545d5e403c7b7a9b34cab4/303_0_3025_2420/master/3025.jpg?width=1200&height=630&quality=85&auto=format&fit=crop&precrop=40:21,offset-x50,offset-y0&overlay-align=bottom%2Cleft&overlay-width=100p&overlay-base64=L2ltZy9zdGF0aWMvb3ZlcmxheXMvdGctZGVmYXVsdC5wbmc&enable=upscale&s=547c88f3ad5033847782f84d74401279"
2025-10-23T17:08:11.053006,TheGuardian,"Anti-malaria funding cuts could lead to ‘deadliest resurgence ever’, study warns",https://www.theguardian.com/global-development/2025/oct/21/global-health-infectious-disease-aid-cuts-malaria-funding-cost-deaths-gdp-africa,2025-10-21T00:00:00,Kat Lay,"<p>Expected reduction in contributions by wealthy countries likely to cost millions of lives and billions in lost growth</p><p>Slashed contributions from wealthy countries to an anti-malaria fund could allow a resurgence of the disease, costing millions of lives and billions of pounds by the end of the decade, according to a new analysis.</p><p>The fight against malaria faces new threats, including extreme weather and humanitarian crises increasing the number of people exposed, and growing biological resistance to insecticides and drugs, the report warns.</p> <a href=""https://www.theguardian.com/global-development/2025/oct/21/global-health-infectious-disease-aid-cuts-malaria-funding-cost-deaths-gdp-africa"">Continue reading...</a>","Slashed contributions from wealthy countries to an anti-malaria fund could allow a resurgence of the disease, costing millions of lives and billions of pounds by the end of the decade, according to a new analysis.

The fight against malaria faces new threats, including extreme weather and humanitarian crises increasing the number of people exposed, and growing biological resistance to insecticides and drugs, the report warns.

Gareth Jenkins, of Malaria No More UK, said: “Cutting funding risks the deadliest resurgence we’ve ever seen.”

Analysts said the cost to sub-Saharan Africa would be substantial, and the region’s leaders have appealed to the G7 to maintain investment. They have also asked the private sector and high-net worth individuals to step in, saying better control of the disease would fuel economic growth and trade.

View image in fullscreen Joy Phumaphi, of the African Leaders Malaria Alliance, said: ‘All of us need to be part of the end story of malaria.’ Photograph: Steffen Kugler/Target Malaria

Joy Phumaphi, of the African Leaders Malaria Alliance (Alma), which co-commissioned the research with Malaria No More UK, said: “African countries are stepping up to the plate, and we are appealing to the rest of the world to accompany us on this journey, because all of us need to be part of the end story of malaria.”

The report estimated the impact of funding cuts to the Global Fund to Fight Aids, TB and Malaria – which is seeking donations to cover costs from 2027 to 2029. The fund provides nearly 60% of all international financing for malaria controls, such as mosquito nets and preventive drugs.

If funding was 20% lower than in the last round, researchers said there would be an additional 33 million cases and 82,000 deaths, and $5.14bn (£3.83bn) in lost GDP by 2030, according to the report.

However, funding cuts look likely. Germany pledged $1bn to the fund last week, a figure 23% lower than its last promise. The UK government is reportedly looking at a figure 20% down on its previous commitment, although it says no final decision has been made.

If a funding vacuum led to preventive malaria control collapsing entirely, the report estimates there would be 525 million more cases, 990,000 more deaths and $83bn in lost GDP. About 750,000 of those deaths would be of children under five, representing “the loss of a generation to malaria”, the report’s authors warned.

Conversely, they said that if the Global Fund received the full $18bn it was asking for, there would be a $230bn boost to GDP, 865 million fewer cases and 1.86 million fewer deaths.

Phumaphi said there had been “marked increases in [domestic] budget allocation not just to health, but specifically to malaria, particularly since the beginning of this year.

But she added: “I think we need to appreciate the enormity of the challenge and exactly how much is required in funding in order for countries to be able to catch up.”

African countries heavily burdened by servicing debt and the economic aftershocks of Covid-19 were facing not only infectious diseases but also a growing epidemic of non-communicable diseases such as diabetes and cancer, she said.

It was worrying, Phumaphi said, that donor countries were considering pledging less than in the last round, “but we are grateful that countries like Germany have pledged substantial amounts – a billion is quite a substantial amount.”

View image in fullscreen Rising biological resistance to insecticides and anti-malarial drugs is one of the challenges faced by the fight to eradicate the disease. Photograph: Desire Danga Essigue/Reuters

The former Botswana health minister said she was hopeful that wealthy individuals, the private sector and foundations would step up “because when we talk about productivity, jobs [and the] economic potential that Africa tends to lose, we are talking about potential investments and markets for the private sector”.

One of those individuals, the Nigerian businessman Aliko Dangote, encouraged others to join him in filling the funding gap: “Malaria is not just a health crisis; it is an $83bn brake on Africa’s growth and enterprise. Business cannot thrive in sick communities.”

Malaria’s impact on GDP was measured using factors including disrupted schooling, employee absences, and the impact on tourism and agriculture.","https://i.guim.co.uk/img/media/0a9bf5a9dc9b420cf2bddfd124e9a9d5c543fea4/720_0_7200_5760/master/7200.jpg?width=1200&height=630&quality=85&auto=format&fit=crop&precrop=40:21,offset-x50,offset-y0&overlay-align=bottom%2Cleft&overlay-width=100p&overlay-base64=L2ltZy9zdGF0aWMvb3ZlcmxheXMvdGctZGVmYXVsdC5wbmc&enable=upscale&s=5f34924f4d668681e82163c4b6f5203b"
2025-10-23T17:08:12.843850,TheGuardian,Tensions mount as Alassane Ouattara seeks fourth term in Ivory Coast vote,https://www.theguardian.com/world/2025/oct/20/tensions-mount-alassane-ouattara-seeks-fourth-term-ivory-coast-vote-president,2025-10-20T00:00:00,Eromo Egbejule,"<p>Protests have been banned and opposition figures sidelined as 83-year-old president ignores calls to step down</p><p>“This is worth several more terms,” the Ivorian president, Alassane Ouattara, joked while opening a bridge named after him in the country’s commercial capital, Abidjan, in 2023.</p><p>The appearance in recent years of several new bridges in west Africa’s second most populous city has been hailed by the president’s supporters as symbolic of an era of modernity and stable leadership under his watch.</p> <a href=""https://www.theguardian.com/world/2025/oct/20/tensions-mount-alassane-ouattara-seeks-fourth-term-ivory-coast-vote-president"">Continue reading...</a>","“This is worth several more terms,” the Ivorian president, Alassane Ouattara, joked while opening a bridge named after him in the country’s commercial capital, Abidjan, in 2023.

The appearance in recent years of several new bridges in west Africa’s second most populous city has been hailed by the president’s supporters as symbolic of an era of modernity and stable leadership under his watch.

Infrastructure building has ramped up around the country and the economy has grown rapidly since Ouattara first took office in 2011 – proof, his camp says, that decades of violent crises have been left in the past.

A sense of deja vu

On a Saturday earlier this month more than 200 protesters were teargassed and arrested across Abidjan, including in neighbourhoods within a mile of the bridge opened by Ouattara two years earlier.

It was the latest in a series of demonstrations by young people against Ouattara’s decision to run for a fourth term in the presidential election taking place on 25 October.

All protests have now been banned by the government.

In another sign of a crackdown on free speech and dissenting voices, leaders of two opposition parties alleged that security personnel ransacked their homes this month, without a search warrant.

“These elections can be won without bloodshed,” said the main opposition candidate, Simone Ehivet Gbagbo. Gbagbo, Ivory Coast’s first lady from 2000 to 2011 when she was married to the former president Laurent Gbagbo, was once known to her supporters as “the Hillary Clinton of the tropics”. Others gave her the nickname “the iron lady” due to her tough reputation.

“The right solution is not to march or boycott,” she said. “The right solution is to vote.”

View image in fullscreen A vendor walks past campaign posters of Ahoua Don Mello and Simone Gbagbo of the Movement of Capable Generations party in Abidjan. Photograph: Luc Gnago/Reuters

For older citizens, there is a sense of deja vu: Ouattara, 83, is almost the same age as his mentor Félix Houphouët-Boigny – the country’s first president – was when an uprising in 1990 led to the country’s first multiparty elections.

In July, he confirmed what people everywhere from roadside maquis (open-air restaurants) to diplomatic dinners had suspected: he was standing for yet another term. In 2020 he reached the same decision, initially declining to run for a third term but changing his mind when his party’s designated candidate died during the coronavirus pandemic, claiming that a 2016 constitutional amendment had reset the clock. The main opposition boycotted the vote and Ouattara won a controversial victory.

More controversy beckons when the country goes to the polls on Saturday.

Two leading opposition figures have been sidelined. Laurent Gbagbo, now 80, is entangled in a past legal conviction linked to the 2010-11 post-electoral conflict. The former Credit Suisse banker Tidjane Thiam, 63, was disqualified after a court ruled he was a French national when he registered to contest, in contravention of Ivorian laws.

Ouattara will face an array of lesser-heralded contenders including Simone Gbagbo and three former ministers.

There are rumours about his health and claims that some of the elite – used to the trappings of power – are encouraging him to stay on. Nevertheless some supporters have called on him to step down to make way for a new generation.

In June, the front-page headline in the weekly Le Sursaut carried a plea from a self-described “allassaniste”: “Dear Papa Ouattara, don’t be a candidate.”

The communication minister, Amadou Coulibaly, brushed off any criticism. “The president is exercising his legal right under the constitution,” he told the Guardian. “He meets all criteria. Citizens are free to vote for or against him. That is democracy.”

Disinformation and disenfranchisement

Officials claim the nationwide infrastructure drive, including a rural electrification programme, has transformed many parts of the country and raised the standard of living.

“This government is committed to fighting poverty,” said Coulibaly. “In 2011, the poverty rate was 55%. In 2024, it dropped to 37%. Our goal for 2030 is to halve that again to around 18%.”

skip past newsletter promotion Sign up to The Long Wave Free weekly newsletter Nesrine Malik and Jason Okundaye deliver your weekly dose of Black life and culture from around the world Enter your email address Sign up Privacy Notice: Newsletters may contain information about charities, online ads, and content funded by outside parties. If you do not have an account, we will create a guest account for you on Newsletters may contain information about charities, online ads, and content funded by outside parties. If you do not have an account, we will create a guest account for you on theguardian.com to send you this newsletter. You can complete full registration at any time. For more information about how we use your data see our Privacy Policy . We use Google reCaptcha to protect our website and the Google Privacy Policy and Terms of Service apply. after newsletter promotion

However, the cost of living has soared, especially in Abidjan, inequality levels remain high, and the average life expectancy is only 59.

“A beautiful Ivory Coast with roads is good, but happy Ivorians are better … Ivorians are not happy,” Simone Gbagbo said after a rally in the central city of Gagnoa. “It is important that if we do politics, it is for the people.”

While Ouattara remains a beloved figure in the north and parts of the centre, his approval ratings have plummeted in Abidjan. France, te former colonial ruler, has become public enemy No 1 in the region, and Ouattara, like his Nigerian counterpart, Bola Tinubu, is seen as a Parisian puppet and adversary of the newly formed Alliance of Sahel States.

View image in fullscreen Demonstrators face police during clashes in Abidjan earlier this month. Photograph: Luc Gnago/Reuters

That perception has been fuelled by a deluge of disinformation, including fake rumours of a coup d’etat earlier this year, that analysts say fits a pattern.

“Most of the campaigns, most of the fake news we’ve observed, come mainly from Burkina Faso,” said Vanessa Manessong, a data analyst at Code4Africa and the African Digital Democracy Observatory. She said the accounts were often pro-Russia and anti-France, and sought to discredit France and sabotage its relations with Ivory Coast.

Ouattara’s popularity dipped more after the treatment of Thiam, who leads a party founded by his great-uncle, Houphouët-Boigny. Thiam’s disqualification is seen as continuing the exclusionary identity politics that has plagued Ivory Coast for decades and was a major factor in the civil wars of 2002 to 2007 and 2010-11.

A tense situation

Ahead of the election, things are tense: more than 44,000 security personnel have been deployed nationwide. Diplomats and some expatriates are sending their families abroad briefly.

In October last year, the influential Student Federation of Ivory Coast, which has allegedly been involved in organised crime since it was established during the 1990 uprisings, was banned after two student murders and caches of weapons were found. There are fears that the group’s many factions could intervene to support their preferred candidates.

Ouattara’s rivals have called for daily protests, hoping for an audit of the electoral register and reinstatement of their leaders.

View image in fullscreen Riot police chase protesters as they break up an opposition protest in Abidjan earlier this month. Photograph: Luc Gnago/Reuters

Coulibaly dismissed concerns of possible voter apathy if the disbarred candidates were not reinserted. “It’s everywhere in the world that people are losing interest in elections … so I don’t want people to stigmatise our continent,” he said. “There’s a global kind of democratic fatigue.”

On a recent trip across one of Abidjan’s new bridges, Kouakou, a taxi driver who asked for his last name not to be used, said he was glad his compatriots were taking to the streets, but that he had resigned himself to another Ouattara victory.

“It’s like an episode of 24,” said Kouakou. “You know Jack Bauer will win but you don’t know what happens before then.”","https://i.guim.co.uk/img/media/c986a132549523710d707d11190b5ba9fb5e5d87/791_0_5271_4217/master/5271.jpg?width=1200&height=630&quality=85&auto=format&fit=crop&precrop=40:21,offset-x50,offset-y0&overlay-align=bottom%2Cleft&overlay-width=100p&overlay-base64=L2ltZy9zdGF0aWMvb3ZlcmxheXMvdGctZGVmYXVsdC5wbmc&enable=upscale&s=b3816fa4157dab81aac1adc527029b18"
