scrape_time,source,title,url,publish_date,authors,summary,text,top_image
2025-10-23T17:08:32.202730,CNN,Error,https://www.cnn.com/collections/intl-trump-040223/,"Wed, 05 Apr 2023 22:50:06 GMT",,,,
2025-10-23T17:08:34.370331,CNN,READ: Trump indictment and statement of facts related to hush money payment,https://cnn.it/411KYN7,2023-04-04T19:48:38+00:00,,"1. How relevant is this ad to you?

Video player was slow to load content Video content never loaded Ad froze or did not finish loading Video content did not start after ad Audio on ad was too loud Other issues","1. How relevant is this ad to you?

Video player was slow to load content Video content never loaded Ad froze or did not finish loading Video content did not start after ad Audio on ad was too loud Other issues","https://media.cnn.com/api/v1/images/stellar/prod/230404161048-02-trump-indictment-unsealed.jpg?c=16x9&q=w_800,c_fill"
2025-10-23T17:08:35.925024,CNN,Russian authorities detain suspect over St. Petersburg cafe blast,https://edition.cnn.com/webview/europe/live-news/russia-ukraine-war-news-04-03-23/index.html,,,,,
