scrape_time,source,title,url,publish_date,authors,summary,text,top_image
2025-10-23T17:07:59.021013,BBC,Met officers sacked for gross misconduct after BBC Panorama Charing Cross investigation,https://www.bbc.com/news/articles/cy0kynx59v0o?at_medium=RSS&at_campaign=rss,"Thu, 23 Oct 2025 15:50:08 GMT",,PC Philip Neilson and PC Martin Borg were dismissed following accelerated misconduct hearings after the BBC investigation.,"Met Police officers sacked after BBC Panorama investigation

1 hour ago Share Save Bruce Thain and Kathryn Armstrong Share Save

BBC

Two Metropolitan Police officers have been sacked for gross misconduct after appearing in an undercover report by BBC Panorama. Three allegations were upheld against PC Philip Neilson, including making ""highly racist and discriminatory remarks"" about different ethnic groups. Five allegations were upheld against PC Martin Borg, with the chair of the panel describing his conduct as a ""disgrace"". Both were dismissed with immediate effect. They are the first two of 10 current or former officers to face hearings as part of the Met's accelerated misconduct proceedings over footage recorded during the Panorama investigation.

During the hearings in south-west London on Thursday, both Mr Neilson and Mr Borg denied being racist and disputed allegations of gross misconduct, but accepted the comments aired in the programme. Chair of the panel, Cdr Jason Prins, said of both officers: ""It was or must have been obvious to him that the comments made were abhorrent."" Mr Neilson was recorded by the BBC referring to an ""invasion"" of ""scum"" from the Middle East, and made offensive comments about people from Algeria and Somalia. He was also observed saying a detainee who had overstayed his visa should have a ""bullet through his head"". The other allegations against Mr Neilson related to ""glorifying what he was describing as inappropriate use of force on a restrained detainee"" and for suggesting unlawful violence against migrants who broke the law. Cdr Jason Prins found all the allegations proven.

The hearing was told that he did not dispute the words he said but argued they only amounted to just misconduct. Giving evidence, Mr Neilson said he had been a police officer for four years and denied he was a racist. He said he believed the undercover reporter ""breached his humans rights"" and it was the reporter who ""kept bringing up these conversations"" and ""egging me on"". Mr Neilson said he had eight or nine pints of Guinness while at the pub when he made some of the comments and said he was not a ""drinker"". He said he did not discriminate against anyone and footage from his body worn camera would show ""no matter the ethnicity I did everything with the utmost respect"". Cdr Prins ruled that Mr Neilson's comments caused ""significant harm"" to the reputation of Metropolitan Police and wider public confidence in the police and amounted to gross misconduct, describing the conduct of the officer as an ""utter disgrace"". The Met had previously said he had ""displayed extreme racial, violent and discriminatory views"", as well as a lack of ""respect, courtesy and professionalism"".

PC Philip Neilson calls immigrants 'scum' in secret filming

PC Martin Borg, who worked out of Charing Cross Police station, was also dismissed on Thursday. An undercover BBC reporter recorded Mr Borg enthusiastically describing how he saw another officer stomp on a suspect's leg in custody. The officer was filmed laughing and saying he had offered to make a statement claiming the suspect had kicked the sergeant first. It is not clear from CCTV footage seen by the BBC whether that was the case. James Berry KC, bringing the case for the Met, said the Panorama programme showed Mr Borg ""revelled in the use of force on detainees"" and made a ""number of discriminatory remarks about Muslims"".

PC Martin Borg described seeing a colleague stamp on a detainee",https://ichef.bbci.co.uk/news/1024/branded_news/bf36/live/72bdf240-b018-11f0-a6e4-031e2de4ddc5.jpg
2025-10-23T17:08:01.557359,BBC,Bloody Sunday: Soldier F found not guilty of murder and attempted murder,https://www.bbc.com/news/articles/c993nlken18o?at_medium=RSS&at_campaign=rss,"Thu, 23 Oct 2025 16:09:04 GMT",,Thirteen people were shot dead and at least 15 others injured on Bloody Sunday in January 1972 at a civil rights demonstration in the Bogside area of Derry.,"Not guilty verdict for Soldier F in Bloody Sunday murder trial

58 minutes ago Share Save Davy Wilson BBC News NI Share Save

Reuters Family members hold pictures of victims of the 1972 'Bloody Sunday' atrocity

A former member of the Parachute Regiment has been found not guilty of murder and attempted murder in Londonderry on Bloody Sunday in 1972. That day 13 people were shot dead and at least 15 others injured on January 1972 at a civil rights demonstration in the Bogside area of Derry. Soldier F, whose anonymity is protected by a court order, faced charges of murdering James Wray, 22, and William McKinney, 26, as well as five charges of attempted murder. The judge said members of the Parachute Regiment had shot unarmed civilians as they ran away, but the evidence against Soldier F had fallen well short of what is required for conviction.

Judge Patrick Lynch told Belfast Crown Court that the members of the Parachute Regiment who had entered Glenfada Park North had ""totally lost all sense of military discipline"". They had, the judge said, shot ""unarmed civilians fleeing from them on the streets of a British city"". ""Those responsible should hang their heads in shame,"" he said.

Bloody Sunday families leave court ""with incredible sense of pride"", says victim's brother

The public gallery was filled with the friends and families of those who were killed and injured on Bloody Sunday, with many travelling from Derry early in the morning, as well as supporters of Soldier F. Speaking outside court Mickey McKinney, whose brother William was shot dead, said the families are filled ""with incredible sense of pride"", despite the verdict. Liam Wray, whose brother Jim was also killed, said it was a ""tough, sad and emotional"" day, adding that, while ""justice had not been achieved"", he ""appreciated the difficulties the judge faced in the case"". ""It takes you back to the horror of [Bloody Sunday]"" he said. ""[To] The wounds Jim had, the situation, the fear, the terror.""

Relatives held held a short silence at the memorial near the spot where many of the victims from Bloody Sunday were killed

A solicitor representing some of the Bloody Sunday families, Ciarán Shiels, said Soldier F was ""the most protected serial killer in British legal history"". ""He has enjoyed every comfort that a victim should enjoy,"" he added. The Bloody Sunday relatives who travelled to Belfast for the verdict arrived back to Derry's Bogside on Thursday afternoon. They held a short silence at the memorial near the spot where many of the victims were killed 53 years ago.

""I hope this brings this process to an end,"" said Veterans Commissioner David Johnstone

Northern Ireland's veterans' commissioner David Johnstone said the trial had brought into focus the ""deep pain"" events of 50 years ago still cause. He said the Bloody Sunday families and all families who lost relatives in the Troubles, ""continue to experience pain"", adding ""we should not forget that today"". Speaking outside court, Paul Young, of the Northern Ireland Veterans' Movement, said soldiers who served in Northern Ireland with ""honour and courage"" had been ""hounded"", but added they would be ""heartened"" by the verdicts. BACKGROUND: What happened on Bloody Sunday?

THE STATE OF US: Soldier F not guilty

'Legal and evidential issues'

The case had presented ""complex legal and evidential issues"", according to the director of public prosecutions in Northern Ireland. Stephen Herron said those ""difficulties have been recognised by the courts"" previously in regards to decisions over who to prosecute in regards Bloody Sunday. He added: ""Our thoughts today are foremost with the Wray and McKinney families, those who were wounded, and the loved ones of all killed and injured on Bloody Sunday.""

Bloody Sunday families and supporters walked to the Royal Courts of Justice on Thursday ahead of the verdict

First Minister Michelle O'Neill said it was ""deeply disappointing"" that the Bloody Sunday families faced a ""continued denial of justice"". ""For more than five decades, they have campaigned with dignity and resilience for justice for their loved ones, their deeply cherished sons and fathers, uncles and brothers,"" the Sinn Féin deputy leader said. ""I extend my full solidarity to the families and to the wider community of Derry who will be hurting today.""

Foyle Social Democratic and Labour Party (SDLP) MP Colum Eastwood said it was a ""difficult day"" for the Bloody Sunday families, but said they could ""hold their heads up high"". ""It is absolutely clear that those soldiers, including Soldier F, shot and killed people on Bloody Sunday,"" Eastwood said. ""These were innocent people, no weapons, just on a civil rights march, mowed down by the Parachute Regiment of the British Army. That's what happened and that's absolutely clear."" He added: ""Everybody knows the victims were innocent and everybody knows where the guilt actually lies.""

Soldier F was found not guilty of murdering James Wray (left) and William McKinney

Democratic Unionist Party (DUP) leader Gavin Robinson welcomed the ""common sense judgement"", but said the trial had been ""a painful and protracted process"". ""There needs to be a better way of dealing with the legacy of the past and to ensure no rewriting of it,"" he said.

The government said it noted Thursday's judgement, adding the Ministry of Defence (MoD) had ""provided legal and welfare support throughout"". ""We are committed to finding a way forward that acknowledges the past, whilst supporting those who served their country during an incredibly difficult period in Northern Ireland's history,"" a spokesperson said.

Who is Soldier F?",https://ichef.bbci.co.uk/news/1024/branded_news/5054/live/10b69000-b01f-11f0-8261-4d7901038185.jpg
2025-10-23T17:08:03.529781,BBC,PM determined to keep Phillips in job as grooming inquiry row grows,https://www.bbc.com/news/articles/cvgwnqeq5z0o?at_medium=RSS&at_campaign=rss,"Thu, 23 Oct 2025 16:27:30 GMT",,"Ministers are also expecting it to be months before they appoint a chair, amid disagreements among abuse survivors.","PM determined to keep Phillips in job as grooming inquiry row grows

40 minutes ago Share Save Chris Mason, Political editor and Jennifer McKiernan, Political reporter Share Save

Reuters

Multiple sources in government are making it clear there is a widespread determination - from No10 to the Home Office - to keep the Safeguarding Minister Jess Phillips in post. Phillips has come under sustained pressure after four members of the survivors panel of the grooming gang inquiry quit and said they would only re-join it if the minister was replaced. Since then, another five abuse survivors have written to the prime minister to say they will only continue to work with the inquiry if Jess Phillips keeps her job. There were, originally, 30 people on the panel the BBC understands - more than has been previously reported.

The government is expecting it to be months before they appoint a chair of the inquiry. The process was thrown into chaos when the leading candidate ministers hoped to appoint, former Northern Ireland police officer and child abuse expert Jim Gamble, said he was not interested in the job. Sources say they are ""taking urgent steps to ensure a new candidate is found"". ""The government will now re-engage with the victims and survivors - to listen to their concerns and take their opinions on the type of person they want to lead the inquiry,"" the BBC was told. We ""will move as fast as possible, but must also take the time, likely months, to appoint the right chair,"" a source added. Sir Keir announced a national inquiry into the sexual exploitation of children by grooming gangs in England and Wales in June. The PM said the inquiry would have the power to compel witnesses to be questioned and would be guided by a panel of survivors, which the BBC understands had at least 20 members at the start. But there has been turmoil over the past week, with Fiona Goddard and Ellie Reynolds quitting the survivors panel in the inquiry on Monday, and two more known as ""Elizabeth"" and ""Jess"" following them on Tuesday and Wednesday this week.

Senior figures in government are acutely aware that the victims of sexual abuse have been repeatedly and profoundly let down by multiple agencies of the state – and so establishing trust is incredibly difficult. ""Upset and vulnerable people hit out when they are in pain, and that is entirely understandable,"" one figure told the BBC. The panel members, we are told, are of a range of views and instincts – on their willingness or not to speak out, on their views on those who chose to do so or not, and on who should chair the inquiry and how it should be run.

The issue was raised at Prime Minister's Questions on Wednesday, when Sir Keir invited the four who had quit to re-join and sought to reassure them that ""I want to get this right"", despite the difficulties when ""every survivor does bring their own painful experience to this"". ""The inquiry is not and will never be watered down. Its scope will not change. It will examine the ethnicity and religion of the offenders and we will find the right person to chair the inquiry,"" he told MPs. However, there was still palpable fury from the group, who penned a group letter calling for Phillips to resign because she had broken a fragile trust. Now, a second group of survivors, headed by Samantha Walker-Roberts, has written to Sir Keir and Home Secretary Shabana Mahmood with a list of seven conditions for their continued support, including Phillips continuing in her role. ""Jess Phillips has remained impartial to the process, only listening to feedback [and] we want her to remain in position for the duration of the process for consistency,"" they wrote. ""Her previous experience and drive to reduce VAWG [violence against women and girls] and her clear passion and commitment is important to us."" They praised Phillips, who they said had ""devoted her life to hearing and amplifying the voices of women and girls who would otherwise have been unheard"" and had helped some of them access support. Earlier today, the first group called on Phillips to quit in order to restore trust in the inquiry, accusing her of ""betrayal"" for describing reports the scope of the inquiry could be widened as ""untrue"". Headed up by Fiona Goddard, the group of four said they would only re-join it if the minister went, because they had ""raised legitimate concerns around the inquiry's direction"" but ""in response, your safeguarding minister, Jess Phillips called our accounts untrue"". Another survivor, known as Carly, from Huddersfield, told the BBC she wanted to remain part of the inquiry, but she also believes Phillips should go, because ""she can't lie about what we all know"" around the question of whether to widen the inquiry's scope.",https://ichef.bbci.co.uk/news/1024/branded_news/ca07/live/321d61b0-b01a-11f0-a6e4-031e2de4ddc5.png
2025-10-23T17:08:05.556450,BBC,Tess Daly and Claudia Winkleman to leave Strictly Come Dancing,https://www.bbc.com/news/articles/cz0x1lr7j92o?at_medium=RSS&at_campaign=rss,"Thu, 23 Oct 2025 16:16:34 GMT",,"The pair have presented the show together since 2014 and said hosting the show had been ""an absolute dream.""","Tess Daly and Claudia Winkleman to leave Strictly Come Dancing

51 minutes ago Share Save Helen Bushby and Emma Saunders Culture reporters Share Save

Watch: Claudia and Tess announce they're leaving Strictly Come Dancing

Strictly Come Dancing presenters Tess Daly and Claudia Winkleman are to leave the show. ""We have loved working as a duo and hosting Strictly has been an absolute dream. We were always going to leave together and now feels like the right time,"" the pair wrote in a joint statement on Instagram. ""We will have the greatest rest of this amazing series and we just want to say an enormous thank you to the BBC and to every single person who works on the show."" The BBC said their final appearance would come on this year's Christmas special show on 25 December.

Daly has presented since the first series 21 years ago. Winkleman joined in 2014, having hosted Strictly's sister show It Takes Two since 2004. ""We will cry when we say the last 'keep dancing' but we will continue to say it to each other,"" said the duo. ""Just possibly in tracksuit bottoms at home while holding some pizza."" Commenting on the announcement, judge Craig Revel Horwood simply said: ""It will never be the same."" His fellow judge Motsi Mabuse wrote underneath Winkleman's instagram post: ""Going to miss you so much! ""You're an icon and inspiration. Still in shock, but wishing you love and best wishes."" Former It Takes Two presenter and Strictly contestant Zoe Ball added: ""Absolute class act. Bravo ladies. Huge love."" One of the BBC's highest-rated shows, Strictly Come Dancing launched in 2004. It was originally hosted by Daly and Sir Bruce Forsyth, who stepped down in 2014.

Winkleman and Daly, pictured the year after they started jointly presenting Strictly

Describing her 21 years on the show, Daly said it was ""hard to put into words"" what the experience had meant to her. ""Strictly has been more than just a television programme. It's felt like having a third child, a second family, and a huge part of my life since that very first show. ""I knew then it was something special, but I could never have imagined the magic it would bring."" She also paid tribute to ""the incomparable Sir Bruce Forsyth"", saying: ""Brucie set the tone for everything that Strictly became: warmth, wit, connection, and pure showbiz magic."" Winkleman, who also hosts Celebrity Traitors, added: ""Strictly is a magical, glittery, fake-tanned train and it's been a privilege to be a tiny part of it. ""It has been my everything, the show I will be eternally grateful for. ""I will never forget Len Goodman trying to teach me what a cucaracha is (I still don't know) and the complete thrill and honour it was to work with Tess on the results show to co-hosting on Saturday nights.""

BBC/PA Media Strictly's current judges are Craig Revel Horwood, Motsi Mabuse, Shirley Ballas and Anton Du Beke

Winkleman and Daly were prime-time Saturday night TV's first female presenting duo. Motsi Mabuse's sister Oti, who was a dancer on the show for seven years until 2022, called their departure ""devastating"". She thanked them for ""all the beautiful memories, for representing female presenters, being iconic, the laughs and years of family you've given all us"". DJ, broadcaster and former contestant Clara Amfo added: ""This is quite surreal. Salute to you both, [it] shouldn't be radical for two women to present prime TV together, you two do it with such genuine joy towards each other. Big respect!"" Presenter Rylan Clarke simply said ""adore you both"", while presenter and former contestant Angela Scanlon posted on Winkleman's Instagram: ""Claud - an absolute legend, effortless, hilarious, quick as a whip and beautifully tender when legs are flailing xx you will be SO MISSED."" Winkleman and Daly also referenced the off-screen friendship they've built up over the last two decades. ""Tess - I'm so so lucky I got to stand next to you. You're funny, kind, whip smart and a true friend and I love you,"" Winkleman said. Daly added: ""To my beloved Claud - what an absolute joy and pleasure it has been sharing this adventure with you. ""You're one of a kind, and I'll treasure every giggle, every live show, and every backstage moment we've shared. I'm so grateful to have you as my friend for life."" The pair also completed an ""agonising"" 24-hour danceathon in 2019 for comic Relief, raising more than £1m by dancing non-stop for 24 hours and five minutes.

Both women described the ""joy"" of presenting the show

Speaking about her decision to leave, Winkleman said she had always believed ""it's best to leave a party before you're fully ready to go"". ""I know the new hosts will be magnificent, I look forward to watching them take Strictly to new heights."" Daly added: ""This isn't a goodbye to glitter, sequins, or Saturday night sparkle (I could never say goodbye to those!). Strictly will forever hold a special place in my heart - but it does feel like the right time to hand over the reins."" Calling Strictly ""one of the greatest joys and privileges of my career"", she thanked the show's audience, saying: ""Your love, loyalty, and unwavering support have meant the world. ""You've carried us through every series, and that has never, ever been taken for granted. ""You are the heart of this show, and I feel so lucky to have shared it with you.""",https://ichef.bbci.co.uk/news/1024/branded_news/ce9b/live/1b3db160-affd-11f0-b2a1-6f537f66f9aa.jpg
